{
  "eventInfo": {
    "title": "ConferinÈ›a de Predicare ExpozitivÄƒ",
    "subtitle": "Predica Cartea Amos",
    "dateRange": "4-6 Martie 2025",
    "location": "Cluj-Napoca",
    "timezone": "Europe/Bucharest",
    "description": "ConferinÈ›Äƒ de formare pentru pastori È™i lideri de bisericÄƒ"
  },
  "days": [
    {
      "id": "day-1",
      "date": "2025-03-04",
      "dayLabel": "Miercuri, 4 Martie",
      "activities": [
        {
          "id": "d1-a1",
          "startTime": "14:00",
          "endTime": "14:15",
          "title": "Sosire È™i Ã®nregistrare",
          "type": "logistics",
          "icon": "ğŸ“‹"
        },
        {
          "id": "d1-a2",
          "startTime": "14:15",
          "endTime": "14:30",
          "title": "Bun venit",
          "type": "other",
          "icon": "ğŸ‘‹",
          "speakers": [
            {
              "name": "MitraÈ™ DudaÈ™"
            }
          ]
        },
        {
          "id": "d1-a3",
          "startTime": "14:30",
          "endTime": "15:30",
          "title": "Sesiunea 1 â€“ RÄƒmÃ¢nÃ¢nd pe linie",
          "type": "session",
          "icon": "ğŸ“–",
          "speakers": [
            {
              "name": "Daniel Suciu"
            }
          ]
        },
        {
          "id": "d1-a4",
          "startTime": "15:30",
          "endTime": "15:45",
          "title": "PauzÄƒ",
          "type": "break",
          "icon": "â˜•"
        },
        {
          "id": "d1-a5",
          "startTime": "15:45",
          "endTime": "16:45",
          "title": "Sesiunea 2 â€“ Structura",
          "type": "session",
          "icon": "ğŸ“–",
          "speakers": [
            {
              "name": "John Folmar"
            }
          ]
        },
        {
          "id": "d1-a6",
          "startTime": "16:45",
          "endTime": "17:00",
          "title": "PauzÄƒ",
          "type": "break",
          "icon": "â˜•"
        },
        {
          "id": "d1-a7",
          "startTime": "17:00",
          "endTime": "17:30",
          "title": "Expunere 1 â€“ Amos",
          "type": "session",
          "icon": "ğŸ“¢",
          "speakers": [
            {
              "name": "Florin MureÈ™an"
            }
          ]
        },
        {
          "id": "d1-a8",
          "startTime": "17:30",
          "title": "Ãncheiere",
          "type": "other",
          "icon": "ğŸ"
        }
      ]
    },
    {
      "id": "day-2",
      "date": "2025-03-05",
      "dayLabel": "Joi, 5 Martie",
      "activities": [
        {
          "id": "d2-a1",
          "startTime": "09:00",
          "endTime": "09:15",
          "title": "Sosire",
          "type": "logistics",
          "icon": "ğŸ“‹"
        },
        {
          "id": "d2-a2",
          "startTime": "09:15",
          "endTime": "10:15",
          "title": "Sesiunea 3 â€“ Contextul",
          "type": "session",
          "icon": "ğŸ“–",
          "speakers": [
            {
              "name": "Daniel Suciu"
            }
          ]
        },
        {
          "id": "d2-a3",
          "startTime": "10:15",
          "endTime": "10:30",
          "title": "PauzÄƒ",
          "type": "break",
          "icon": "â˜•"
        },
        {
          "id": "d2-a4",
          "startTime": "10:30",
          "endTime": "12:00",
          "title": "Grup mic 1 â€“ Amos 1:1â€“2:3 È™i Amos 2:4â€“16",
          "type": "meeting",
          "icon": "ğŸ‘¥",
          "description": "Lucru Ã®n grupuri mici"
        },
        {
          "id": "d2-a5",
          "startTime": "12:00",
          "endTime": "12:45",
          "title": "PrÃ¢nz",
          "type": "meal",
          "icon": "ğŸ½ï¸"
        },
        {
          "id": "d2-a6",
          "startTime": "12:45",
          "endTime": "12:55",
          "title": "AnunÈ›uri â€“ AnunÈ›uri de instruire",
          "type": "other",
          "icon": "ğŸ“¢"
        },
        {
          "id": "d2-a7",
          "startTime": "12:55",
          "endTime": "13:25",
          "title": "Q&A â€“ ÃntrebÄƒri È™i rÄƒspunsuri",
          "type": "other",
          "icon": "â“",
          "speakers": [
            {
              "name": "ToÈ›i vorbitorii"
            }
          ]
        },
        {
          "id": "d2-a8",
          "startTime": "13:25",
          "endTime": "13:30",
          "title": "PauzÄƒ",
          "type": "break",
          "icon": "â˜•"
        },
        {
          "id": "d2-a9",
          "startTime": "13:30",
          "endTime": "14:30",
          "title": "Sesiunea 4 â€“ Conectarea la Evanghelie",
          "type": "session",
          "icon": "ğŸ“–",
          "speakers": [
            {
              "name": "John Folmar"
            }
          ]
        },
        {
          "id": "d2-a10",
          "startTime": "14:30",
          "endTime": "14:45",
          "title": "PauzÄƒ",
          "type": "break",
          "icon": "â˜•"
        },
        {
          "id": "d2-a11",
          "startTime": "14:45",
          "endTime": "16:15",
          "title": "Grup mic 2 â€“ Amos 4:1â€“5 È™i Amos 4:6â€“13",
          "type": "meeting",
          "icon": "ğŸ‘¥",
          "description": "Lucru Ã®n grupuri mici"
        },
        {
          "id": "d2-a12",
          "startTime": "16:15",
          "endTime": "16:30",
          "title": "PauzÄƒ",
          "type": "break",
          "icon": "â˜•"
        },
        {
          "id": "d2-a13",
          "startTime": "16:30",
          "endTime": "17:00",
          "title": "Expunere 2 â€“ Amos",
          "type": "session",
          "icon": "ğŸ“¢",
          "speakers": [
            {
              "name": "Daniel Suciu"
            }
          ]
        },
        {
          "id": "d2-a14",
          "startTime": "17:00",
          "title": "Ãncheiere",
          "type": "other",
          "icon": "ğŸ"
        }
      ]
    },
    {
      "id": "day-3",
      "date": "2025-03-06",
      "dayLabel": "Vineri, 6 Martie",
      "activities": [
        {
          "id": "d3-a1",
          "startTime": "09:00",
          "endTime": "09:15",
          "title": "Sosire",
          "type": "logistics",
          "icon": "ğŸ“‹"
        },
        {
          "id": "d3-a2",
          "startTime": "09:15",
          "endTime": "10:15",
          "title": "Sesiunea 5 â€“ Linia melodicÄƒ",
          "type": "session",
          "icon": "ğŸ“–",
          "speakers": [
            {
              "name": "Daniel Suciu"
            }
          ]
        },
        {
          "id": "d3-a3",
          "startTime": "10:15",
          "endTime": "10:30",
          "title": "PauzÄƒ",
          "type": "break",
          "icon": "â˜•"
        },
        {
          "id": "d3-a4",
          "startTime": "10:30",
          "endTime": "12:00",
          "title": "Grup mic 3 â€“ Amos 5:1â€“17 È™i Amos 5:18â€“27",
          "type": "meeting",
          "icon": "ğŸ‘¥",
          "description": "Lucru Ã®n grupuri mici"
        },
        {
          "id": "d3-a5",
          "startTime": "12:00",
          "endTime": "12:45",
          "title": "PrÃ¢nz",
          "type": "meal",
          "icon": "ğŸ½ï¸"
        },
        {
          "id": "d3-a6",
          "startTime": "12:45",
          "endTime": "13:45",
          "title": "Sesiunea 6 â€“ Aranjamentul",
          "type": "session",
          "icon": "ğŸ“–",
          "speakers": [
            {
              "name": "John Folmar"
            }
          ]
        },
        {
          "id": "d3-a7",
          "startTime": "13:45",
          "endTime": "14:00",
          "title": "AnunÈ› â€“ Formulare de feedback",
          "type": "other",
          "icon": "ğŸ“‹"
        },
        {
          "id": "d3-a8",
          "startTime": "14:00",
          "endTime": "14:15",
          "title": "PauzÄƒ",
          "type": "break",
          "icon": "â˜•"
        },
        {
          "id": "d3-a9",
          "startTime": "14:15",
          "endTime": "15:45",
          "title": "Grup mic 4 â€“ Amos 7:1â€“8:3 È™i Amos 9:1â€“10",
          "type": "meeting",
          "icon": "ğŸ‘¥",
          "description": "Lucru Ã®n grupuri mici"
        },
        {
          "id": "d3-a10",
          "startTime": "15:45",
          "endTime": "16:00",
          "title": "PauzÄƒ",
          "type": "break",
          "icon": "â˜•"
        },
        {
          "id": "d3-a11",
          "startTime": "16:00",
          "endTime": "16:30",
          "title": "Expunere 3 â€“ Amos",
          "type": "session",
          "icon": "ğŸ“¢",
          "speakers": [
            {
              "name": "John Folmar"
            }
          ]
        },
        {
          "id": "d3-a12",
          "startTime": "16:30",
          "title": "RugÄƒciune È™i feedback",
          "type": "worship",
          "icon": "ğŸ™"
        }
      ]
    }
  ],
  "activityTypes": {
    "logistics": {
      "color": "#9CA3AF",
      "icon": "ğŸ“‹",
      "label": "LogisticÄƒ"
    },
    "session": {
      "color": "#3B82F6",
      "icon": "ğŸ“–",
      "label": "Sesiune"
    },
    "meal": {
      "color": "#F59E0B",
      "icon": "ğŸ½ï¸",
      "label": "MasÄƒ"
    },
    "break": {
      "color": "#FDE68A",
      "icon": "â˜•",
      "label": "PauzÄƒ"
    },
    "worship": {
      "color": "#8B5CF6",
      "icon": "ğŸ™",
      "label": "Ãnchinare"
    },
    "recreation": {
      "color": "#10B981",
      "icon": "âš½",
      "label": "Recreere"
    },
    "meeting": {
      "color": "#EC4899",
      "icon": "ğŸ‘¥",
      "label": "Grup mic"
    },
    "other": {
      "color": "#6B7280",
      "icon": "ğŸ“Œ",
      "label": "Altele"
    }
  },
  "settings": {
    "showEndTimes": true,
    "showIcons": true,
    "showLocations": false,
    "showSpeakers": true,
    "highlightCurrentActivity": true
  }
}
